own_land_of_iay_num,house_type_num,type_of_indebtedness_num,means_of_livelihood_num,gp,average_monthly_income_num,operational_land_size_group,labour_force,father_name,migration,availability_of_normal_water_num,village,food_security,operational_land_type,food_security_num,drinking_water_facility_plain,district,migration_num,assistance,means_of_livelihood,labour_force_num,ownership_of_consumer_durables_num,sanitation_num,drinking_water_facility_hilly,average_monthly_income,ownership_of_consumer_durables,drinking_water_facility_hilly_num,children_status_num,house_type,social_category,social_category_num,family_name,assistance_num,operational_land_type_num,availability_of_normal_water,operational_land_size_group_num,sanitation,drinking_water_facility_plain_num,status_of_the_highest_literate_adult_num,children_status,family_id,block,type_of_indebtedness,own_land_of_iay,status_of_the_highest_literate_adult
0,1,0,99,MANGARAJPUR,1,Nil,Only adult females and no child labour,Late Bhima Mandal,Casual work,0,JUNGLE BLOCK NO.26,Normally one squire meal per day but less than one squire meal occasionally.,Tenant,1,NONE,GAJAPATI,0,Wage employment/TPDS(Targeted Public Distribution System),0,2,0,0,< 50 mtrs elevation,Less than 250,Nil,8,0,Kutcha,SC,3,Parbati Mandal,0,2,Less than 2,0,Open defection,99,0,Not going to school and working,10060,R.UDAYAGIRI,For daily consumption purpose from informal sources,Yes,Illiterate
1,1,0,99,MANGARAJPUR,2,Less than 1ha.of un-irrigated land(or less than 0.5 ha. of irrigated land),Others,Late Jagabandhu Mandal,Non-migrant,1,JUNGLE BLOCK NO.26,Two squire meal per day with occasionally shortage,Both Owner & Tenant,3,NONE,GAJAPATI,3,Wage employment/TPDS(Targeted Public Distribution System),1,4,0,0,< 50 mtrs elevation,250 - 499,Nil,8,2,Kutcha,ST,1,Tumeswar Mandal,0,3,2 or more but less than 4,1,Open defection,99,2,Going to school and not working,10059,R.UDAYAGIRI,For daily consumption purpose from informal sources,No,Completed Secondary (Passed class X)
1,1,0,99,MANGARAJPUR,5,Less than 1ha.of un-irrigated land(or less than 0.5 ha. of irrigated land),Others,Late Jagabandhu Mandal,Non-migrant,2,JUNGLE BLOCK NO.26,Two squire meal per day with occasionally shortage,Owner,3,NONE,GAJAPATI,3,Housing,3,4,0,0,> 100 mtrs elevation,More than 2500,Nil,6,2,Kutcha,ST,1,Pradep kumar Mandal,3,1,4 or more but less than 6,1,Open defection,99,3,Going to school and not working,10057,R.UDAYAGIRI,For daily consumption purpose from informal sources,No,Graduate / Professional diploma
0,3,2,99,MANGARAJPUR,5,Less than 1ha.of un-irrigated land(or less than 0.5 ha. of irrigated land),Adult males only,Late Gopinath Pradhan,Other purpose,2,JUNGLE BLOCK NO.26,Enough food through out the year,Owner,4,NONE,GAJAPATI,4,Housing,3,3,0,0,< 50 mtrs elevation,More than 2500,Nil,8,2,Pucca,ST,1,Gangadhar Pradhan,3,1,4 or more but less than 6,1,Open defection,99,3,Going to school and not working,10056,R.UDAYAGIRI,For other purpose from informal sources,Yes,Graduate / Professional diploma
0,1,4,99,MANGARAJPUR,2,Nil,Adult males only,Kumuti Mandal,Other forms of livelihood,1,JUNGLE BLOCK NO.26,Two squire meal per day with occasionally shortage,None,3,NONE,GAJAPATI,2,Training and Skill upgradation,4,3,0,0,< 50 mtrs elevation,250 - 499,Nil,8,0,Kutcha,ST,1,Kora Mandal,2,4,2 or more but less than 4,0,Open defection,99,3,Not going to school and working,10058,R.UDAYAGIRI,No indebtedness and possess assets,Yes,Graduate / Professional diploma
